{
  "schema_version": "1.0.0",
  "authorization_id": "human-story-1-3",
  "contract_digest": "sha256:aaaaaaaaaaaaaaaaaaaaaaaaaaaaaaaaaaaaaaaaaaaaaaaaaaaaaaaaaaaaaaaa",
  "source_revision": "1111111111111111111111111111111111111111",
  "trusted_base_revision": "2222222222222222222222222222222222222222",
  "authorized_protected_paths": ["contracts/agent-authority.json"],
  "approval_anchor_revision": "3333333333333333333333333333333333333333",
  "approver_kind": "human",
  "provenance_digest": "sha256:4444444444444444444444444444444444444444444444444444444444444444"
}
